Description,Rating
"Wow. I've never been steered so wrong before, but my goodness, Urban Ritual was a terrible choice for boba. Ready to be blown out of the water, I dragged the hubby to Urban Ritual, located on a super busy street in San Francisco (although, what street is never busy?). The parlor itself is boring, but it has one accent wall with their logo and name. The menu is also extensive, having a few specialty drinks and another list of flavors so that patrons can concoct their own.I decided to get their house milk tea while the hubby got The Cloud, a cold brew coffee drink that was advertised to have notes of dark chocolate. Prices are typical, but keep in mind that the cups are downright tiny. However, in our case, we didn't mind the small size because we ended up throwing our drinks away anyway.The house milk tea was hideously bland. If I let it sit on my tongue for a bit, perhaps I could taste the notes of black tea, but it was honestly just water. The only decent aspect was how smooth it was. As for the hubby's drink, The Cloud was just bitter and boring. Yes, the coffee flavor was strong, but there was no creaminess to it and definitely no dark chocolate. It was just a boring iced coffee.Perhaps we chose the wrong drinks. Perhaps we stopped by at the wrong time. But there's one thing we know for sure: we aren't coming back.",1.0 star rating
"I don't care how many times I need to circle around this block and the adjacent areas for parking because I know that when I find parking... I can hit Urban Ritual and go two blocks on Laguna to grab a scoop of honey lavender from Salt & Straw.I'm so grateful that Urban Ritual hasn't, to my knowledge, tried a take on a strawberry matcha latte because that's really one of two main reasons I go to Boba Guys (it's the SML and their Duke of Earl Grey). The quality of UR's drinks in terms of taste and presentation is leagues above the chains (e.g., Sharetea, T4, iTea, Happy Lemon) and I'm actually frightened they'd eclipse Boba Guys in my heart, haha.So far I've tried the Creme Brulee which has spoiled all other creme brulee adaptations at every other boba spot I've gone to. You actually get that rich, custardy goodness AND the caramelized, slightly burnt, sugar topping, too. I also really like their Forever Young and White Grape Yuzu if I'm craving something non-milk based and fruity. I'd say the WGY is a much lighter flavor than FY; FY may be fruit-based but it's pronounced. Wonder what that would be like with real sangria...Props to UR for their specialty drinks and special ones to the person who did the hand lettering on their menu boards - beautiful job!",5.0 star rating
"I wanted to like this place, but their boba was just okay. To be honest, I didn't walk in so I don't know the vibe of this place, but based on pictures and their menu selection, this should have been a winner. On a cold Saturday night after dinner, my bf and I were craving a sweet drink and this was one of the few boba places opened later. Sorry, not trying to drive out of my way to Boba Guys. Saw this cute little joint and had the bf jump out and pick up the drinks.I got a Matcha Boba with Oat Milk (trying to copycat my order at Boba Guys). He got the House Black Milk Tea. It was not bad, but it wasn't great either. I forgot if it was the actual boba or the drink itself that was the meh part. So just based on their drinks itself, I remembered I didn't really like it. But maybe that was a one off.",4.0 star rating
ordered the creme brûlée with boba. tastes exactly like it sounds. The boba was hard though flavor: 4/5freshness: 5/5boba texture: 3.5/5,5.0 star rating
"Came on a rainy Tuesday night and it was a pleasant surprise. It was a cozy atmosphere and there were quite a few tables available to just sit and chat. The interior was clean and decorated nicely.The cashier was patient with us as we were taking forever to decide what to order. Ultimately, I ended up getting the safe choice: jasmine milk tea with pearls with adjusted sugar levels. It was actually quite good! I will be returning to this place :)Only downside is that there's no restroom available.",4.0 star rating
"Best Earl Grey Milk Tea I've ever tasted! I'm always picky about my earl grey because honestly it's a hard milk tea to make well. Too much cream and you only taste the milk. Too much tea and it somehow tastes like soap water. (Teaspoon and Sharetea so far are my boba shops to avoid Earl Grey like the plague!)But, when I first walked into the Urban Ritual, and the nice cashier offered me a sample of their Earl Grey Black Tea mixed with Classic Milk and 75% (or 70) sugar, I fell in love at first taste. I then bought the Earl Grey Milk Tea at 75% sugar with honey boba, which I enjoyed every sip of! The honey boba wasn't too mushy (a nightmare if it is) and the sweetness of the honey was absolutely delectable.I absolutely HAD to buy another cup for my mom to try because she also loves Earl Grey, and carried that cup gingerly with me all the way back to Milpitas! (The cup saw a 1 hr 30min journey of walking to the nearest BART station, being jostled around on the rickety BART, and the drive back home) Needless to say, my mom loved it too and we'll definitely have it again when we go back to SF. I'll also be back to try everything else on their menu and be extremely extra while taking pics again, haha. It will be MY urban ritual to have their boba every time I visit SF!",5.0 star rating
"I love andytown - the coffee, corn muffins (apparently gluten free), and the baristas. I was hesitant on getting the limited Philippines coffee blend, and the barista offered to make me a cup from the bag if I purchased it. Never tasted kalamansi notes in coffee before, not bad!5 stars for customer service, corn muffins, and ocean vibes.",5.0 star rating
"An employee like girl eating ramen at the front entrance of the coffee shop? I was greeted by this strong instant ramen smell. I guess big no no for that? I wish to smell coffee, not ramen?!? The vibe here also can't compare with the one on Lawton. It's just dead and the barista giving a not want to be here that kind of energy. I had their pour over, at least the coffee is decent. I then discovered avenue which is just across the street, they serve verve (not my favorite) and the vibe is much better.",2.0 star rating
"First time to Andytown. The layout and staff is very guest friendly. Grab a coffee or specialty, sit down and relax. Ordered a Cafe Au Lait, good tasting house blended coffee, not strong but just enough flavor to burst through the milk.  Located in Sunset District (near Ocean Beach) by Golden Gate Park, it's a great place to pick up a hot beverage and head out to the beach.Happy Cafe and Fight On!",4.0 star rating
Went here with my family for coffee/tea.  It's a small place without indoor seating except a small wood shelf/bench.  There is some limited outside seating-a wood bench in a U shape with a few small round attached tables.  They do have a restroom.  They offer mainly coffee and tea drinks and some pastry like scones etc.  One drink is a plover that is flavored and much like an Italian cream soda.  One of us had the huckleberry-flavors change.  I had the real ginger tea that had slices of ginger in it and I really liked it.  It helped to let it sit for awhile to really pick up the ginger taste which I happen to love.  It was a nice place for a short stop.,4.0 star rating
Yummmmmm. Cool little spot. I love the coffee and bread. Worth the drive out of the city and worth the time to hang by the ocean in sunset.,5.0 star rating
"This was our first time at this coffee shop, and we really liked it. We got a hot chocolate with fresh whipped cream on top and a Snowy Plover; both were REALLY good. The employees are also nice and fun. We really liked the back patio seating.",5.0 star rating
"Hipster coffee shop located a block away from Ocean Beach.Been here quite a few times and it's one of my favorite coffee shops in SF. Their menu is unique because they offer a drink called ""Snowy Plover"" and different variations of it. Personally I skipped it because I'm not a fan of soda water!!My favorite go-to drink here is their Iced Mocha with their house made whip cream. Their whip cream is like crack so yummy and fluffy. I usually also ask for extra whip, a must!Prices are you average coffee shop prices raging from $4-$5 a drink. Usually spend about $10 if I'm with my boyfriend for 2 drinks.Customer service is fast and friendly. In this location they only have outdoor seating, all the way at the back of the store. They also have a nice bathroom which is a plus.Lovely coffee shop to drop by before your day at the beach.",4.0 star rating
Love this place.  Serves very good strong coffee. Staffs very friendly. They roasted their beans in house. East street parking. Very cozy atmosphere. Tried their latte first time. Will try their other drinks next time with the soda water!,5.0 star rating
"As mentioned before, my housemate and fiancé purchased many items from here in the past but only recently had I actually ventured in and got some things. Staff are so sweet and helpful. I usually make my way here after a few mile walk and get one of their almond latte's with the brown sugar simple syrup which is very tasty and not too sweet. I still love their apple and sausage corn muffin. One of the few muffins I can still enjoy lol. Glad it's an easy pick up close to home. Gonna miss this place when I move next year. Prices are fair and I always tip. They have dog treats that for some reason my housemates dog can't stand (she's picky and SPOILED) but it's cool they have them. Totally worth checking them out if you're close by. It's nice to have something other than a bar in the neighborhood. I'm kind of annoyed at the choices for morning and afternoon fare in this area. I just wish they had more offerings. I think they'd do really great offering a simple breakfast sandwich and small lunch options since they are open as late as they are. Brownies only take me so far in life LOL",5.0 star rating
"Very interesting special drink...the snowy plover is unusual because of the carbonation, but tasty nonetheless. I was hasty in my ordering and picked without reading the description. My first sip was met with mixed feelings, perhaps due to my own naivety. It took me a bit to truly enjoy the drink, but ultimately, I enjoyed it. The whipped cream on top was definitely delicious. The surroundings were clean, simple, and elegant. My friend and I enjoyed the small outdoor space in the back. It was chilly and a bit damp, but the sun came out and warmed up half of the space. I would come back and love to try their matcha drink.",5.0 star rating
"I love the vibe and service of Andytown. The coffee aromas remind me of ritual. It is the quintessential SF coffee shop complete with single brew coffees, $5 toast (mediocre), and specialty drinks (plover). I wasn't a fan of the plover which is soda water and coffee, so this time got the mocha instead. 3.5 stars for the mocha, in which you can really taste the quality chocolate. I wish it was creamier and more chocolatey though. The soda bread tastes like pita and is drenched in butter. The other sliced multigrain is also dense but looked too healthy. If you like dense toast I would instead recommend The Mill.",3.0 star rating
"Andytown adventures in the Sunset! I had been to the Lawton location near Ocean Beach and today I decided to take a trip to the Andytown on Taraval. I decided to lose my ""snowy plover"" virginity and get this drink. It's a coffee with seltzer water and half creamy coffee..also a dollop of whipped cream. It was okay and maybe I'll have a caffeine kick. I'm not sure. The interior is nice. There is no seating inside. You can sit outside in the back. This coffee business is interesting, so I decided to visit. Although, I would probably visit Lawton and not Taraval more often.",4.0 star rating
"Came here on a Saturday morning and there was a line out the door. The line moves at an okay pace, but gosh the lattes are good! I highly recommend stopping by this place to grab a latte before you go to ocean beach or lands end! Patio area shields you from the ocean winds.",4.0 star rating
"Delicious and unique. I have tried Andytown's cappuccinos, Matcha Snowy Plovers, and the Peach Corn Bread and all were delicious. Snowy Plovers are a cold drink (coffee or matcha or whatever they're serving seasonally) with a huge slab of whipped cream on top: It looks almost like a root beer float or an affogato. The whipped cream is DELICIOUS; I wanted to just eat it by the spoonful. I enjoy this coffee shop because it encourages people to sit outside and talk since there really isn't much table space to do work. It's a block away from the beach and the street is full of palm trees. Definitely recommend checking out this location or the one on Lawton!",5.0 star rating
"tldr: The coffee cafe serves a drink called the ""snowy plover,"" and it can be made with matcha or espresso. Get it. Very good. Mix the cream before drinking. The ""snowy plover"" drink is why people come here. The drink is carbonated water, matcha/espresso, and a chunk of sweet cream. Make sure to mix the sweet cream before drinking, otherwise the drink can be off balanced. Less seating than other location, but new garden seating at back of cafe to open soon. Quiet neighborhood location. Short walk to the beach. See the drink's namesake: snowy plover birds on the beach.",5.0 star rating
"Excellent latte - very smooth and flavorful. I still like blue bottle more, but this is still very good. Seating is limited - but there's a nice back patio.",5.0 star rating
"Great 3rd wave coffee roaster in town and so close to the beach! There are sitting area in the back or the front, whichever you like. Long bench for various coffee brewing method. They rotate the specialty coffee beans every few months.Parking was not too bad, people park perpendicular to the street.",4.0 star rating
"Love this coffee spot! The peeps that work here are amazingly friendly! Great for sunny afternoons- grab your favorite coffee here, bring a book and enjoy their outside patio!",5.0 star rating
"My husband is a huge fan of coffee and I am a huge fan of independent/local coffee establishments. We finally made it out here to try their coffee. We don't normally hang out in the outer sunset. Located a couple blocks from the beach and from the SF ZOO. Otherwise, it is basically residential and parking is not an issue. I ordered a cafe au lait and my husband ordered a regular coffee. I had cafe au lait earlier in the year in New Orleans and well obviously, this doesn't compare. The coffee is a bit acidic but better than another local coffee joint that we went to the day before. It was a chilly morning but I would have liked to try one of their plovers given how popular it is. Nice interior that is very modern and simplistic. Nice spacious sliding door unisex restroom. Outdoor seating that is more for a limited time. The seats appears moist from the fog so we opted to walk around and drink our coffee in the car. I would come back if I was ever in the area but would not come out of my way.",4.0 star rating
"SF has always been known for coffee, but Andytown has really taken innovation of coffee up a notch. Stopped by with my girlfriend and got the infamous snowy plover. It seemed like it was made with sparkling water, shot of espresso, and topped with heavy whipping cream. After posing a few times to help my girlfriend get a nice Instagram photo of the decor, I finally got to take a sip of the drink. It was certainly different than my normal latte from Starbucks. It was very carbonated, but not too overwhelming. The buttery texture of the whipped cream was the highlight especially since we watched them whip it out freshly in front of us. It is one of those drinks that continue to grow on you and before you know it, the snowy plover was gone. I liked how they illustrated the ""bird theme"" throughout the store and it made it seem like we were just enjoying a cup of coffee right in the outdoors.",4.0 star rating
"Solid artisanal coffee shop in San Francisco, but I didn't really see anything that differentiated them from other artisanal coffee shops in the city. I stopped by around 11:45am on a Saturday, and it wasn't busy at the time. They had two pour over options to choose from in addition to the usual options of latte, etc. They also had a cold brew option available. I opted to try their Yirgacheffe Pour Over ($5), which was super smooth, but had a slightly acidic finish. They roast their beans in the back of the shop, which would be cool if they did a mini tour, or had a display window or something along those lines. Beans are around $14/bag. They also had some cookies available (vegan and non), but no other food options. Parking was easy at that time, and there were good metered street parking spots. I believe there is also one free street spot on the street right before the cafe.",4.0 star rating
"Below-the-radar artisanal coffee shop with an emphasis on single-origin coffee from Ethiopia. Their pour-overs are exceptionally well balanced, neither bitter nor acidic (a sign that the coffee extraction was just about right, neither under-extracted nor over-extracted). They roast the coffee beans themselves. The espresso we tried was from Columbia. The latte is quite smooth with an earthy/fruity profile, the kind you have come to expect from good coffee baristas. Definitely recommended if you are in the area.The only minus is that it was freaking cold in there. The building is an old warehouse of sorts, I guess not very well insulated and not well heated. In this current SF weather, this can get challenging! Bring a coat or try to snatch the one table that is by the front window.",5.0 star rating
"Wavering between 3 and 4 stars. It's a nice place that I wouldn't mind coming back to, but I wouldn't go out of my way for it. I would be more motivated if they made their pastries in house lol but they do source from good bakeries at leastStrengths:-Chai latte - it's on the sweeter and not spicier side which makes me sad but the drink is SO CREAMY and thick idk how they do it and it impresses me tremendously-free wifi that's strong and reliable-they roast their own coffee without coming off as snooty as four barrel lol the vibes here are more relaxedQuestionable: -Drip coffee isn't necessarily a dark roast in the grand scheme of things, but it's definitely a dark roast compared to all other bougie SF coffee shops (think ritual, st franks, four barrel). Maybe the roast level is comparable to equator and philz",3.0 star rating
I had the mocha latte here and it was pretty good. Good quality coffee and chocolate from the mocha was just enough to get a nice taste without being too overpowering.The place has a nice vibe and is a good ares to relax and talk. Great seating both inside and outside (though it was a little cold when we went so we were inside).,4.0 star rating
A great new addition to San Francisco coffee scene. The coffee is actually really good. I would say better than even Blue Bottle. The cafe has a warehouse feel to it. It's open and well lit during the day. At night this could be a spot fit for a date. They do lack breakfast items. When I visited only cookies were on display during breakfast time.,5.0 star rating
Surprisingly big coffee shop! Located not in the best area but the coffee shop is cute and has outdoor seating in the back. Coffee is yummy! I also had a vegan cookie which was only okay but not bad. Great vibe if you are close by.,5.0 star rating
"Cool vibes, yummy mocha, oat milk for the lactose free. Good vibes to do work, some tasty pastries, the wifi works, the drinks are hot, the baristas are friendly, and it's got a cool warehouse feel throughout... what else can you look for in a coffee shop? Great spot to meet a friend, schedule a meeting, or jam away on a project.",5.0 star rating
I'll definitely be back. Sextant has delicious coffee with an excellent fruity almost citrusy tang. Friendly service at the counter and nice tables and space to hang out or work.,5.0 star rating
"Really hard to support a business that straight up steals another local coffee roaster's swag. They know they done goof and whose sweater + design they are ripping from, but won't step and do the right thing. Boo!",1.0 star rating
They just got busted for stealing Cento coffee's logo for their t shirt. Frickin pay a graphic designer to do something original. . Bad neighbor / totally disrespectful to Cento coffee family. Boycott this place. There's plenty of other coffee in the area including Vega coffee.,1.0 star rating
"Life sure gets busy. For reasons I don't need to bore you with, I've recently been spending a lot more time in the East and South Bay. Some of it by choice, some of it not really. That means taking leisurely strolls around my SoMa neighborhood don't happen nearly as often as they did before. That also means discovering and hanging out at quietly relaxing coffee spots like Sextant becomes both a pleasure and a privilege. I'm treasuring moments like these a lot more lately, and it actually helps that the neo-industrial vibe of the space fits the neighborhood like a glove, not an O.J. glove, a real one (photo: bit.ly/2zMaSYk).The café and adjoining roastery are run by Kinani Ahmed, who was born and raised in Ethiopia, a fact pertinent to his business. His unique heritage informs the choice of coffee beans as they come from his country as well as Kenya and Colombia. I ordered a $3.25 cup of their signature Yirgacheffe coffee which had an unbridled richness that was most suitable for a brisk Saturday morning (photo: bit.ly/2BSyRqD). They offer all the standard caffeine variations as well as tea options and cookies on the counter (photo: bit.ly/2Ecokb8). I know now to make a beeline here whenever I'm casually walkin' the 'hood.COFFEE - 4 stars...the Ethiopian blend is most soothingAMBIANCE - 4.5 stars...the rustic SoMa vibe works well here, and it's pretty quiet in hereSERVICE - 3.5 stars...quietly efficientTOTAL - 4 stars...no Sightglass pretensions here, just good Ethiopian coffee",4.0 star rating
"Great cafe with a well-balanced decor, vibe and business. The atmosphere is open and bright. There's an outdoor area in the back, well suited for SF's consistently moderate weather. The coffee is roasted in-house and the results are evident to the palate. Wifi connection is strong even during primetime. And there's a somewhat automated bathroom to remind you you're still in SF.",5.0 star rating
Bad latte. Bad cafe au last. Rude barista. Creepy people walking around outside.Will not return.,1.0 star rating
"As a 65-year old, perhaps I'm not hip enough for Sextant. Yesterday I wandered in and ordered a croissant and a latte. The barista handed me a croissant but forgot that a latte was ordered as well, so I paid again. She handed it to me with the comment, ""latte to go."" I replied that it was ""for here,"" (she didn't ask) but that it was no big deal. When I asked another barista for the bathroom key, she gave me an explanation that I couldn't hear over the grinding of coffee, so I just left.These observations are not major. The coffee was good but it was the attitude that annoyed the heck outta me.  Little interaction, not even an ""oops"" when she forgot my coffee, and for $10.25 for a small latte and a croissant, it's just not worth it.I won't be back and I'm sure they will do just fine without me as a customer.",2.0 star rating
"The coffee ar Sextant is really good. They have a great interior design going with lots of natural light coming in. Plenty of space to work while enjoying a perfectly made soy cappuccino. Their prices are decent too for specialty drinks with soy or nut milk.It would be great however if they could offer some type of vegan pastries options. Everything they have had dairy unfortunately. This is a major and growing segment of the market and not offering at least one vegan option, in San Francisco, is just out of touch. Hopefully they can figure it out. I'll still go there for coffee. It's good stuff.",4.0 star rating
Really good drinks. Thank you Sextant for making good stuffIm coming next time in my pajamas,5.0 star rating
"Frustrated enough to finally post here about Sextant.  Today is yet another time they've forgotten about my coffee and I've had to catch a ride before they could make one or get a refund.  I've also in the past put my order in before a large group, and then had the large group served first.  To add to that, I used their ourmenu.io order ahead service and it ended up literally charging me thousands of dollars due to a software bug that ordered hundreds of coffees, and it was a hassle to deal with fixing that.Their coffee and the environment is great, but the frustrations with the service have been piling up.",3.0 star rating
"I live a block up from Sextant and thus make it my coffee stop quite often. I normally get the dirty chai the ""Wired Gandhi"", theirs has a far higher chai flavor which is what I'm constantly seeking from every chai I sip. But if you're anything like me, and don't like too sweet, you may ask them to put a little less chai in the drink, and it makes all the difference. Still one of my fave chai spots. The regular lattes and cappuccinos are good too - their Ethiopian blend is suuuuper smooth and smoky.The decor is really cool and looks like reclaimed wood with an industrial feel. Great quiet-ish place if you wanna get some work done!",5.0 star rating
