Description,Rating
"Wow.Just wow.Get yourself the churro with dulce de leche. Wont go wrong. dense. chewy. not like your carnival, costco or disneyland churro.Empanada wise, I had the sweet meat, provolone, spinach and cheese, and chalos. All delicious in their own right. I am used to small versions of empanadas so to see these large puffy ones was a delight to my eyes.The interior of the space is airy and hipster like. One quickly forgets what was once the copper kettle. I can see myself hanging out here when i need a different venue to get work done.Now the workers: the cashier was extra nice to me. the owner came up to me and asked how were things, and i said great and delicious. he walks away. as i was leaving, i look for the owner who was talking with other new patrons at the large communal table, and when i got to the door, i turned around and i said ""thanks"" out loud at his direction, and he just looked at me and went back to talking. therefore one star off.",4.0 star rating
"Ordered the drip coffee ($3) and churros ($3.95) with dulce de leche dipping sauce ($1.00). You get 3 churros in each order. Churros were really fresh, hot, crispy on the outside. The dipping sauce was okay, I could have done without. The coffee is good but really wish they had non-sugar sweetener. Only offered brown sugar and simple syrup. Nice ambiance, playing oldies, bright & airy. Good for groups, hanging out. Need to come back to try their empanadas which are not available until 10am.",5.0 star rating
"I have passed this place on the train for months and have been patiently waiting for them to open. My first time in today did not disappoint!! I absolutely LOVE the handpainted sign on the front of the building and the decor of the inside of the restaurant. I ordered the sweet churros and three empenadas (Jamon y queso, Pollo picante, and tres quesos). The three cheese empenada was absolutely A M A Z I N G because it included blue cheese inside of it which I wasn't expecting. For anyone who doesn't know me I am obsessed with all cheese especially the stinky ones! Everything felt very reasonably priced and everything we had was so dang tasty! Their menu also included breakfast sandwiches + coffee, beer, wine, and some non alcoholic drinks. I am so freaking excited for this restaurant to be a part of the community!!!!",5.0 star rating
"So happy to see a place like this in this neighborhood! You can get espresso coffees, beer, wine, churros, and empanadas. It's a bright space that seems like a happy place to hang out in.We tried the churros with dulce de leche, empanada picante, and Sightglass brewed coffee. Everything was fresh and tasty! They had their grand opening on March 23 and are still working out kinks in stock (several items were out of stock at 10am). However, I'm sure they will dial-in soon.The owner is wonderful and attentive.",4.0 star rating
"Fresh, delicious Argentine empanadas in the Outer Sunset?! Who would have guessed?!Unfortunately, I gave up meat for Lent so I only tried the spinach and cream empanadas, but they were heaven. As my boyfriend said, their dough is perfection. They also have both dessert and savory churros, sandwiches, a full coffee bar, and Bare Bottle beer. The barista made me a delicious hot chocolate that definitely tasted special.The decor is well-done and homey; farm-style with tables and bright blue walls. It fits perfectly in the Outer Sunset and is definitely family-friendly. The owners are a husband-wife couple; one grew up in the Sunset and the other in Argentina. I definitely recommend a stop here, especially since it's right off the L-Line!",5.0 star rating
The churros are well made for me I wish the sold a side of cinnamon with sugar. We had coffee and hot chocolate what is expected. The empanada was very tasty.,4.0 star rating
"Oooh, something new on Taraval!! Came in around 11am, ordered 2 empanadas and was not disappointed! They aren't as dense as other empanadas I've had, but the crust was amazing. Got a little oil on my leg, but it was worth it. Definitely coming back to try the churros and coffee :)",5.0 star rating
"Cute empanada shop! Came here for a quick snack on a Saturday afternoon. My boyfriend and I shared 3 empanadas, ham and cheese, carne, and the spinach and cheese.  They were all super crispy and piping hot. Ham and cheese was super cheesy, all kinds of cheese pulls after each bite which I liked, but there was very little ham inside and I could barely taste it. Carne was tasty, full of beef, and very flavorful from the spices, peppers, and onion. This one was one of my favorites and I look forward to trying the Carne Picante my next trip!Spinach and cheese, was the opposite of the ham and cheese, it was LOADEDDD with spinach with less cheese. Still yummy.Overall everything was pretty good, I felt like it was a tad pricey for the size of each empanada, but if I was in the area looking for a snack I would come back again.",4.0 star rating
"Empenandas were great! Coffee was good. WiFi isn't up yet, recently opened in the past 3 weeks, and a quite location to study! Note: I believe there are no plugs.Will update this post in a few weeks",5.0 star rating
Ordered their champignones and carne dulce empanadas. Overall it was pretty good. Not too oily. Perfect amount of filling. Interior: Cute little set up. Note: They start selling empanadas @ 10:00 am.,4.0 star rating
"I was super excited about this place. I walked in at 9:47 with the intention of ordering 12 or so empanadas and some churros. I was told they can't take empanada orders till 10am. So I can't order. And was further told they can't just take the order and - even if they don't start making till 10am because the kitchen gets overwhelmed. There was no sorry for the inconvenience or anything,  all she said was ""you'll just have to wait a couple of minutes"" and turned around to continue doing what she was doing. This could have been (barely) excusable if they posted clear signs that you can't order certain items on the menu before a certain time, but there wasn't. The cashier in fact had to reconfirm this 'policy' before saying anything.  They surely went interested in selling me anything this morning, so good luck with business. From the pics on yelp, this seems like this is a place people would like to instagram, provided they can actually order anything in the morning.",1.0 star rating
"Finally there is a place in the bay area that sells authentic churros just like how it suppose to taste like the ones in Madrid, reminescense of  Chocolatería San Ginés. If you've already tried the standard churros in SF, this porras are a thicker, more doughy version and well worth a try. This delectable treat may not seem like it would be that addictive, but it really is - once you start dipping, you may eat several churros sticks without even realizing it.As well, this place also sells authentic Argentinian empanadas. The empanadas here reminds of the ones I ate at El Sanjuanino in Bueno Aires. You get the option of either fried or baked, I love both. There were all sorts of empanadas on the menu, such as carne, carne picante, pollo and various vegetarians ones such as provolone, espinaca, choclo, and champignones.I have traveled to numerous places around the world and ate at many outstanding restaurants and I can say this place is legit. So if you want the best authentic Churros and Empanadas, you can either go to Chocolatería San Ginés in Madrid and El Sanjuanino in Bueno Aires or save a plane ticket and go to the sunset to eat at Chalos.",5.0 star rating
"On Chalo's first day:I drove my S.O.'s parents to the airport that morning.And then my aunt and I caught up on some things we had to discuss.Then.. ended up here with her and two of my cousins. It is gentrified, but the empanadas are actually really good. We got empanadas. I got the #3: Carne Picante. HIGHLY RECOMMEND.^The filling was great. The shell was super crispy and good. I tried getting a chai latte: didn't have it. Tried getting the Spanish Hot Chocolate: didn't have it. I got the hot chocolate: they had it and it was alright.. not worth it. I mean for the price it's whatever.. But, Nestle at home for the win.My aunt got churros: I liked their chocolate sauce for it (I think it's a mix of caramel and chocolate.. or it's definitely not just straight up chocolate).",5.0 star rating
"Just tried this new local neighborhood spot and really love what they did with the place.  Had an assortment of the empanadas, an order of the churros and a latte (Sight Glass coffee).  They were all really good.  My favorite is the Carne empanada.  They were not as dense as others I've had.  The decor is understated but cute.  The staff was really nice and attentive.  I'm so happy to have this join the hood!",5.0 star rating
"They are so delicious.  Tried the carne, pollo, tres queso and the spinach and cream cheese.All made to orderChurros yummy too",5.0 star rating
The food and service here are outstanding.  Everything is made on-demand.  The churro with dulce de leche was tender inside and crunchy outside without being too hard to bite.  The ham and cheese empanada was golden crisp and stunningly good.Inside it's light and airy with a South-facing window.  You can't lose.,5.0 star rating
"This place is incredible! It's a dessert-only restaurant occupying the original Ike's Place location that has an incredible variety of really cool desserts.Make a reservation when available, otherwise be ready to stand in line for 30-40 minutes. These guys are making much better use of the space than Ike's. Tables in every crevice of the place and all of them are packed.We started with the Young Coconut Pandan Crepe cake. This was a series of coconut flavored crepes piled on top of each other which you can then drizzle with a sweet coconut sauce. It had a really delicate flavor and just melted in your mouth. In a place like this, this was probably the most conventional dessert you could order.Next up was the Thai Tea Lava Toast. This was sort-of like a bread bowl dessert soup. A Brioche bowl filled with this yummy Thai Tea sauce and lots of brioche chunks and then topped with Thai Tea flavored ice cream, whipped cream, and nuts. This was the best dessert of the night. Absolute must have. Kinda like a pre-soaked dessert fondue. So good!!The final dish was the Igloos Kakigōri. This was a giant pile of shaved ice with a marshmallow-ey exterior and served with a kiwi sauce and some sort of condensed milk that you are supposed to occasionally re-drench the igloo with. To start it off, they set it on fire with some kind of alcohol which makes it a really fun dessert to order. As you keep digging inside the snow, you discover it is actually filled with some sort of lychee balls that sort-of explode in your mouth. This is a lot of fun to eat.Need to come back here and try everything else on their menu.",5.0 star rating
I was looking forward to go here !!!Finally I got the chance!!!The desserts here are so good! Yummy and good for taking pictures LolOur favorite is Mango Sticky Rice Toast!!!!The people here are so friendly:)We will come again to try something new,5.0 star rating
"- Coconut pandan crepe cake: without the sauce it comes with, you don't really taste much & just be chewing on the coconut. With the sauce, this is just a coconut crepe cake. Not much pandas flavor- Thai tea float: a little thick consistently, not too sweet, really good.- Mango bingsoo:Love the seed and caramelized coconut on top, gives a nice crunch. The shave ice underneath has a subtle sweet coconut taste which is good because most places is just straight ice or milk. Very refreshing.   - Great place to take photos because the natural lighting & decorations. Even the desserts are insta-worthy",5.0 star rating
"A rare breed indeed.  A full service restaurant (not merely a bakery or sweet shop) that focuses on desserts.  And a nice departure from the European-centric patisseries around town as the menu here is very Asian influenced.  Everything I had was delicious with a few items ranking in the most memorable desserts ever.Igloos Kakigori: This was so much entertainment to watch.  The outer meringue is browned a bit already, but they finish it off by pouring a flaming liquid on top.  Tastes a bit like s'mores when it's all done.  Really loved the fresh kiwi syrup poured over the shaved ice and eaten alongside the meringue, it was like like a frozen kiwi version of a key lime pie.  The condensed milk poured on top worked nicely too.  At the bottom was the nice surprise of little balls filled with what seemed to be lychee.  This dessert looked massive, but it wasn't overfilling thanks to all the ice.Matcha Crepe Cake: I'm not stranger the multi-layer crepe cake.  I've had it at many venues with many different fillings.  The matcha here was intense.  Like not just some sweet cream with a tiny bit of matcha.  It was almost like matcha paste, there was so much powder going on.  On one hand it was a nice contrast to the other desserts which are really sweet.  But some folks at our table thought it was too bitter.Thai Tea Lava Toast: This surprised me.  It looked like another incarnation of Japanese-style Honey Bread.  And in a way it was, since the box was nicely toasted and full of buttery goodness. The bread cubes inside rode that fine line of being somewhat crispy, but also fluffy inside.  But the surprise came with the massive amount of Thai Tea flavored ""lava"".  After getting our photos, we cracked it open and that delicious sauce covered most of the massive plate.  The bread bits helped soak up a bunch and it was also nice dipping in some fruit, almost like fondue.  Definitely took this style of dessert to the next level!",5.0 star rating
"Great spot for a dessert date. Their desserts are definitely Instagram worthy. This place is small. You can make reservations on yelp in advance, if you like.I came here with my boyfriend on a Sunday afternoon. Thankfully, this place wasn't packed, we got sat down immediately. Downside, the tables or floor had a strong bleach smell which made me lose my appetite, a little. It was tough deciding what to get. So many things we could order but we decided to order their Thai Tea Toast and Matcha Lava cake. The lava cake came first. It was DELICIOUS! You have to order this treat when come here. Highly recommend. The cake and matcha flavor was perfectly paired, the green tea ice cream on the side was cherry on top. Presentation, of course, BEAUTIFUL.The Thai Tea Toast was good, but I thought it was overwhelming. It was topped with whipped cream and a scoop of thai tea ice cream. The bottom was toast cubes with tons of Thai flavor cream. The cream on the bottom was warm, so it melted the ice cream really fast. I had to scoop some of the lava cream out, it was too much.Overall, loved the cute concept. Pricing wise, it's on the higher end. We spent about $30 on just two desserts, no regrets. It was delicious, and no doubt I'll be coming back for more.",4.0 star rating
"What can I say about U: Desert Story but U need to go check them out for their interestingly savory deserts. I wish I could post the video that I took of me cutting open the match chocolate lava cake and how the matcha lava just poured out. It was such a beautiful site. While there I witnessed several other deserts that were ordered by other customers and each one has its own uniqueness and flare, and for some of the deserts it was literally flare with flames. I will definitely visit again and try out some more deserts. I recommend U checking them out if you're in the area looking for a unique desert spot in San Francisco.#travelnurseswithoutboarders",5.0 star rating
"My friends have been talking about U:Dessert Story and how unique and pretty their desserts are for some time now. So, I decided this past weekend to go check it out for myself. I made reservations via the Yelp app and it was quick and easy. We came here on a Saturday late afternoon and there was just a slight wait. The place was fully packed and i wasn't surprised at the least.I shared the Young Coconut Pandan Crepe Cake and their Mango Sticky Rice Bingsoo. First of all, I want to say the Mango Sticky Rice Bingsoo was so so good. The Bingsoo is finely shaved ice and you can add as much condensed milk to sweeten it to your liking. I highly recommend this to share and I would come back just for this item. However, the Pandan Crepe Cake was very blah and I actually did not like this item at all. I definitely would not order this again or recommend you do either.Our waiter was quick and all of the staff were moving quickly while we were there. The interior is simple but cool to look at. There is a selfie wall with their branding on the wall where you would wait for a seat, which is along the right wall when you walk in. Their desserts are all over instagram as they photograph very well. I'm sure I'll be back soon to try more of their sweet menu.",4.0 star rating
"Loved the matcha chocolate lava cake-- rich, sweet, dense and creamy. May have not been worth ~$13 (more expensive than my lunch that day) but I have no regrets!The cheese tea is pretty good and there is a lot of cheese if that's your vibe.Didn't really enjoy the thai tea crepe cake as much. Texture slightly rubbery but then again I've never had a crepe cake before so maybe that is how it is supposed to be? The flavor and sweetness mainly came from the custardy bit which allowed me to control the sweetness. Wish they had more of that though!As for wait time, it was pretty reasonable. There was no line when I went and I also didn't make a reservation. We got seated at the ""bar"" immediately.",4.0 star rating
"4.5 stars. Finally an Asian inspired unique dessert place in the neighborhood with loungy relaxing vibes. This one is a Japanese Thai dessert place sitting right in the middle of Castro.  We passed by and decided to give it a go before dinner because it smelled amazing when we walked in to check it out. We got the matcha crepe cake which was delicious. Not too sweet - just how I liked it.  A bit of bitterness from the goodness of matcha. Fantastic combination of matcha, red bean, and soft layered cake. The only suggestion that I had was to make the mille feuille pastry component more flaky and structured so you could actually taste the 20 layers when you are biting into it. We also saw the next table getting the volcanic Thai  shaved ice and it looked good. The next table devoured it pretty quickly which is always a great sign.",4.0 star rating
Love this place! My friend and I went here for dessert after grabbing a bite at Super Duper. Luckily we were able to grab a reservation so we didnt have to wait that long. But they still made us wait for about 15 minutes. This place gets super packed so I highly recommend getting reservations. I got the matcha lava cake and the iced matcha latte and my friend got the Thai Tea crepe cake. Everything was so yummy and had the cutest presentation. My fave has got to be the Thai tea crepe! It was so light and spongey almost. The thai tea flavor wasnt too overpowering either and it wasnt too sweet. Cant wait to come back and try more things!,5.0 star rating
"All of the reviews are true. U Dessert is BOMB!My friends and I came here on Friday after dinner around 7pm and only needed to wait for 5 minutes for a table of 3. I appreciate how efficient the staff was here by asking people in line what they wanted to order in advance and once you were seated at your table, your dessert came out within minutes!We've ordered the Thai Tea Crepe, Mango Stick Rice Bingsoo, and Pandan Coconut Crepe and each of it was very good. The texture and sweetness is seriously on point, nothing too overwhelming.Probably one of the best desserts joint's I've had so far in SF.",5.0 star rating
"Dessert Story is soooo good. I came here actually during their soft opening months ago and didn't know it would blow up this big! Then again, it's in prime real estate and the desserts are cute af! I cannot stress enough how reservations are highly recommended. I came here a few days ago without one and it was quite terrible. There's two lines, a second line to acknowledge that they know you're waiting. Then you get to the first line and now they can see you waiting...What I hate is when there is a long line at a restaurant and groups who are done eating are just sitting there talking...we were in line for at least 1.5 hours and when we left, this group of ladies was still there...talking....? Anywho, desserts are super yummy. I've had the thai tea millecrepe and the mango sticky rice bingsoo. Both of which are amazingly delicious. Not to mention, everything here is instagrammable ;) No parking in this area, usually takes 20 min to circle around or longer.",4.0 star rating
"Delicious but totally and ridiculously overpriced!  For that, I'd have to deduct a star.  Also, some of the tables were placed way too close to one another creating some discomfort for the customers.  For that reason, I'd have to deduct half a star.The service was excellent.  The waiters were all super professional and very friendly.For the food, my bf and I ordered Mango Sticky Rice Bingsoo and Thai Tea Crepe Cake.  I'd have to deduct half a star for the crepe cake, please read the details below.The Mango Sticky Rice Bingsoo was absolutely heavenly.  The shaved ice was milky and smooth.  The sticky rice was chewy, sweet, and topped with crunchy toasted coconut (I think).The Thai Tea Crepe Cake was just meh.  One good thing was the whole dessert wasn't too sweet.  But the crepe itself was too dry.  There were some parts of the cake where the crepe wasn't covered by any cream, so I got to try and taste the crepe just by itself.  And it unfortunately wasn't good.  And it cost you $12.  I wouldn't order it ever again.  Sorry.",3.0 star rating
"Cute little place with yummy desserts. Hard to choose what to try. Nice selection of sweet, salty, fruity and chocolate. We shared the Volcano Bingsoo & Chocolate Matcha Lava Cake and were very happy. Next time, I'm ordering my OWN volcano!!Went on a Sunday afternoon and luckily didn't have to wait for a table, though the place was almost full. Sounded like they take reservations.",4.0 star rating
"Everything comes out with such a pretty presentation. definitely perfect for the gram. Everything you order comes out super fast. Ordered:*Pandan crepe cake- looked great. tasted okay.*Thai tea crepe cake- i thought it looked way better than it tasted. i am not quite sure what i was expecting flavor wise. but texture wise it definitely was soft. but wasn't my favorite crepe cake. *Mango and sticky rice bingoo - i liked it! it comes w/coconut flakes, coconut milk, condense milk, sticky rice, & the shaved ice and mango. you will pretty much put it together yourself. *Blue lychee (drink)- it has two lychee and lychee flavored popping boba. loved the color of the drink. pretty good as a drink.so they move quick here. they seat you fast, they take your order quickly, and they give you the check fairly fast. even though they say take your time, its really get the heck out someone is waiting for your table. and its true, the line is out of the door, its pretty packed. thank goodness for reservations on yelp. and even then my party of 6 had to wait about 15 mins. they had a ton of things i wanted to try but i didn't want to go too crazy. now that i tried it and got it out of my system, i wouldn't come back. there's so many other places in SF i want to try. if you haven't been to U dessert, i say give it a try. but not worth an hour wait if you ask me. Tips: *Accepts reservations on YELP.*It's hot inside!*Cash and credit card accepted *WiFi available *Street parking*indoor seating only",4.0 star rating
"You can make reservations on yelp! Made reservations for Sunday at 1:45pm, but didn't really need it since there was no wait. Probably better for night, as I can see this place getting really busy. So I follow them on IG and found out they just released a new flavor of bingsoo... durian! Omg was it everything and more than I hoped for! They only offered it in their small size, which was for perfect for my friend and as we got the small mango as well. Durian bingsoo ( actually soft durian pieces not the frozen kind and durian sticky rice on the side, served hot!) Mango bingsoo ( mango was Tart, but perfect combo since the durian was sweet, also comes with sticky rice) Can't wait to come back and try more!",5.0 star rating
"Snow cream is my kryptonite and Dessert Story delivers and excels. First thing first- the menu just has too many delicious options. We spent 5 minutes debating what we wanted because everything looked great. Ultimately, we were able to decide on the coconut crepe cake and the mango sticky rice bingsoo- both were delicious. I really have difficulty deciding which was my favorite.Only issues I have with Dessert Story is that the space is small and the wait can be brutal- we lucked out and only had to wait 10 minutes on a Wednesday night.Then again, Na Ya, the other dessert house with similar quality items also suffers from a brutal wait so there's really no winning. Luckily, you can make reservations here so that's probably the best call. The other issue I have is the drinks are so pricey!!! I wish they were cheaper, but whatever.Still my favorite dessert spot in the Castro.",5.0 star rating
