Description,Rating
$6.50 for a turmeric matcha seems a bit steep but... I guess Lower Haight is coming up in the world. I had to put my headphones on because this place is teeny-tiny and the two gals working there were ranting back and forth about work drama. That's fine just not super professional. No biggie though. They have WiFi which is why I stopped in. The barstools are not very comfortable though - this is the kind of place that obviously wants their customers in and out.,3.0 star rating
"It's not a far cry to say it's one of my favorite coffees in the city. Beans are great ( Temple ) & truth be told, I'm addicted to their butterscotch latte - 1/2 sweet, with almond milk, and every time - they deliver with a smile. All of them, which is a f'in rarity these days. The coffee isn't the only thing that's warm here :) I just moved closer to the neighborhood and couldn't be happier to start my mornings/kick start my afternoons with one of their bevs. Plus, it's a locally owned by amazing women, and I can't not support them. Take my money guys, I'll be back for another tomorrow ;)",5.0 star rating
"This place is fantastic - for coffee, toast, and friendly baristas/owners! It is owned and operated by a lovely set of twin ladies. This hits home for me as my twin and I have always dreamed of opening up our own coffee shop :). I ordered the dirty turmeric chai and it was delicious! A perfectly balanced drink. They happily accommodated my request of 2% milk - it's rare these days to find that as places only carry skim and whole milk.We also order the Pesto Tomato Toast and holy moly it was superb. The pesto was so good! And they use the perfect bread for avo toast - nicely grilled. As a millennial, I approve! They also have gluten free bread to accommodate those with dietary restriction.This cute cafe had a constant flow of folks coming in and out and for good reason! I highly recommend coming her for your joe and toast :). Best of luck to these ladies!",5.0 star rating
"Stopped in on our way out of San Fran because it was close to our AirBnb. The coffee was GREAT. I got a latte with an extra shot made with oat milk and it was super good. My roommate got the cold brew and enjoyed it also.Honestly, the only thing keeping this from a 5 star review was the avocado toast. I got it to-go so didn't even look at it until we got in the car. I probably just misread the description, but it was a couple slices of avocado on a piece of bread... I know, that's literally ""avocado toast."" It's just not the normal mashed plus some extra seasoning/veggies/whatever that I'm used to. Like I said, coffee and everything else was great though!",4.0 star rating
Cute very friendly coffee shop on Divis. I got a cortado and it was very good. I've heard their food is also good. There is a small bench with a table on the sidewalk. Nice neighborhood spot. Very relaxed.,5.0 star rating
Just discovered this tiny place as I was walking down Divisadero. The pastry and the mocha were a bit too sweet for my taste but pretty good nonetheless,4.0 star rating
"I come here a couple of times a week before my morning walk, and it is a perfect way to start my day.  Very approachable team, superb coffee and espresso selection, although I always get the cold brew (sorry for taking so much of it!).  They have all the milks (oat, cream, almond, etc. etc.) if needed.  Also have pricey but DELICIOUS baked goods like donuts, bars, and natural pop-tarts etc.Not a ton of seating, have a good bar in the front and side to have a seat, but perfect community coffee shop for a cup to go.",5.0 star rating
"I really loved Native Twins! I just stopped in for a cold brew in the morning, and I enjoyed the whole experience! The flavor of the coffee was incredible, the service was quick and friendly, and I loved the ambiance. I will definitely be back next time I'm in San Francisco!",5.0 star rating
"The lattes at Native Twins are absolute perfection. I used to get the espresso latte, but I stopped drinking coffee/espresso several months back and switched to the matcha latte (also have tried the turmeric and chai latte). Whatever the latte, it's always delicious and the perfect temperature (I find that a lot of coffee shops steam their latte milk way too hot, which is a big no no). The matcha latte, specifically, is smooth, earthy, and not overly sweetened. I've had a lot of matcha lattes from other coffee shops in various places and I always find myself judging them against Native Twins' because it's my gold standard that remains unparalleled.  I could be biased because, beyond the drinks, the owners/baristas are wonderful: their service is warm and quick. The eponymous twins run a lovely coffee shop that epitomizes what a great local business is and makes me proud to live in the Nopa area.",5.0 star rating
"Okay so there are several coffee places to choose from on Divisadero in Lower Haight, but this one is definitely my favorite. First, the coffee shop is super cute, the walls covered with record albums. Second, the coffee is really good. It is a bit pricier than I might normally spend on coffee but its definitely of quality. The only downside to the place is that it's not very big so I wouldn't plan on hanging out there. They did have some outside seating on the sidewalk however.",5.0 star rating
"Love this spot. Pretty small but with a large personality. Very kind staff, good coffee, and yummy avocado toast. Got the garlic variation which was a bit intense recently but the traditional is extremely tasty.",5.0 star rating
"One of my favorite coffee shops in the city! Their coffee is just perfect! Not weak, not too strong (burnt), just right! I also love their little muffins! Perfect place, great location, nice service! Totally recommended!!! :)",5.0 star rating
"I love Native Twins. Their coffee is amazing, trust me, I am Italian. Their avocado toast is the best, trust me, I am a Millennial. Jokes aside, I really like this spot, their home made granola is excellent, and so are their pastries, from the same lab as Cibo in Sausalito.The Mill Valley twins are fun to chat to and they have an extensive record collection, plus it's really nice to be able to order ""the usual"", as there isn't the barista turnover you see in other coffee places in the area.I totally recommend it!",5.0 star rating
"Great vibes here all around. Plenty of dogs and good food and snacks. Women owned business. Great ambiance great coffee free WiFi. I ordered pluot toast, turmeric green tea latte with oak milk. I discovered both pluot jam and oak milk on my visit there. They were kind enough to explain it to me. I can't wait to go again",5.0 star rating
"I love this place. I try to come as much as I can because this really is my favorite coffee shop. As a former barista/coffee snob, this place has everything you look for. Great beans, great people, and that intimate feel that makes a local coffee shop part of the neighborhood. You can't miss with their cold brew!",5.0 star rating
"Tried this spot a little while back and it was okay! The spot is easy to miss but once discovered, it's super cute and the staff is really friendly. Unfortunately, I was pretty disappointed by the coffee. I got the coconut & butter latte and my sister got the vanilla bean. The flavors just weren't there. When I tried my sister's, it tasted exactly like mine -- just a plain latte. Bummer because it's a $5 coffee. The morning bun was delicious though! Maybe it was an off day but I don't plan on returning to this location.",3.0 star rating
"These delightful twins have added matcha, chai, yum pastries, and yum coffee plus great juju to the block. I highly recommend making this a regular spot.  also a fab park-let to enjoy your treats outside!",5.0 star rating
"I really love this place! Delicious lattes with so many different milk replacement options. Soy, heavy cream, almond milk, etc. This beats sight glass for sure! Tasty toast and pastries as well. It's a local business owned by 2 lovely twin sisters that are super nice. Support!",5.0 star rating
"Native Twins is a cozy little cafe nestled in the hills of the Haight district. Jen (who usually helms the coffees/teas) is a magician of a barista. I've never had cappucinos or pour over coffee quote like hers, and she shows her expertise and care without a doubt. Ashley made my toast today and I was beyond impressed. As a consumer, I've always enjoyed simple yet delicious foods, and these toasts theyvenconcocted are just that. I ended up not only getting the avocado toast, but the garlic butter and then a third on the sweeter side - cinnamon! Everything was amazing. The decor is very sleak, the ambience terrific, all with the steady backdrop of classic rock&roll. (Check out their posters on the wall!) Even though I live across the Bay in Berkeley I will for sure be back!",5.0 star rating
"Another cafe that has been on my bookmark in like forever, and I finally had the time to check it out.We came Tuesday morning around 10am hoping that it would not be packed but it was. As we were in line I tried to look for a table and was lucky enough to find one as a group of people were just leaving.We ordered birthday latte (duh! that's why I wanted to go here, lol), cookie monster latte, hot chocolate, cinnamon toast, egg in a basket and condensed milky way toast. Everything was really good. The lattes were not too sweet, they were perfect. The latte art were so cute! It's making me want to learn how to do them =)I can't wait to go back and try the rest on the menu!",5.0 star rating
"It's an alright spot if you're nearby. My dentist happens to be closeby. This spot is definitely over hyped now. You will come if you have a habit of IGing your coffee or cafe foods. That being said, the one in the Richmond is better.Things to note:-Nice place to work only if you don't mind the noise level. Between the music, espresso machine, patrons, and cafe worker's friends it can get loud even with headphones so bring your noise cancellers.-The specialty coffees are super high in calories and sugar. They don't serve nonfat or unsweetened almond milk. -Dont get the cookie monster. It tastes like a butter stick fell into your already-bland milk laden coffee.-Nothing special to say about the drip coffee. The roasts are a little watery so it's a bit bland but its the healthiest thing on thr menu probably.-If youre going to IG, get the birthday cake for the rainbow latte. If you care, request for a specific picture or youll get something normal like a heart.-My biggest disappointment: It's freezing in here. Bring a jacket or layer up if you plan on working in here. They won't close the door due to ADA reasons--which I understand and am all for the accommodations but I have never seen a shop or restaurant have a door that absolutely must be kept wide open 'due to ADA'. You can't just close the door and leave it a little ajar instead of freezing your patrons? With 50 degree weather i don't know any place in SF that leaves their doors wide open. Stop by if you're nearby or need a spot to work. But unless you're planning to take a selfie with your coffee, skip this spot as destination.",3.0 star rating
"So cute and such a fun place to study or chat with friends! I ordered the birthday cake latte, and my friend ordered the red velvet latte. Both were incredible! I personally like my lattes on the sweeter side, so the birthday cake latte was perfect :) I had a sip of my friend's latte as well, and I loved it as well!Would definitely recommend coming, and would recommend both lattes!",5.0 star rating
"Drink wise, I thought the lavender latte was tasty. It had a light lavender flavor that paired well and didn't overpower the flavor of the latte. I also really liked their pesto chicken toast, but I was disappointed to find out when I came back for a second time that they took it off the menu.",4.0 star rating
"Cute little coffee shop in the area. Trying to find a breakfast spot with no line or wait is difficult, especially on a weekend. HOME has fast friendly service. Their lines move pretty quick and since the food is simple, there is barely any wait. They have tables and bar style seating inside. Since many people like to come and hang out or do work on their laptops here, there are specific tables where it is strictly for eating/enjoying coffee AND tables that you can use your laptop at.......I like that concept. The menu is limited to coffee drinks, a few toasts, and pastries. Simple. Their drinks are tasty and most important.... pretty and instrgramable!",5.0 star rating
One of the reasons my friends and I stopped by here was because of the cool latte art. The menu is filled with various different lattes to choose from. I went for the hazelnut latte which was very good. They also have options if you're lactose intolerant. Did you know oat milk is a thing? Well I didn't till I came here and apparently when swapped with regular milk in lattes it's barely noticeable that it's not regular milk! The workers were super nice and very helpful about any questions I had. They also have types of toast if you want a little snack as well. I did not get the chance to try it but I definitely will the next time I am here.What's not to love about this cafe? From it's cute and simple decor you really can't go wrong. It's the perfect place to bring your laptop and get some work done while enjoying a latte. It is a bit small so it can fill up quickly so my suggestion is come a little early if you're planning on hanging out for a bit.,5.0 star rating
"We tried out Home in the Outer Sunset, it was only 1 mile from the dumpling place but hubby didn't want to walk so we took Uber/Lyft - one of those car service.I ordered birthday cake latte $5.75 - it's very colorful artwork and has candy sprinkles on top.  I liked it.Hubby got Cappuccino and it had a nice cappuccino art on it.Lots of folks in there.  I can see it being very busy on weekends, glad we tried it on a weekday.",4.0 star rating
"So disappointed. I trekked all the way out here to get a cool design on my latte only to receive a heart?! The cashier told me all the lattes came with the cool designs when I asked. I was furious when I picked it up from the counter and saw that heart. Also, they charge extra for milk substitutes-sorry I'm LACTOSE-INTOLERANT! Don't punish me by charging extra for it. They don't make their own syrups in house which also makes it not worth the high price tag. A place back home that I love makes their own syrups and their lattes are less than this. I had the coconut vanilla latte. It was good, but nothing special.I could've spent this $6.50 on dessert or better food. The positive is that Home is a conducive place to studying. They have a long line of tables and chairs set up and outlets. The first few tables have a no laptops sign, just a heads up.",3.0 star rating
"Cute interior, can get very crowded and seating is difficult. This place is worth visiting if you're in the area and have never been.My lavender chai tasted watered down, I couldn't taste the lavender. I tried my friends' drinks and they were better - maybe it was just a bad order.I'll visit again with friends but if I'm just looking for a to-go order, I'd probably stop by Henry's a couple of blocks down instead.",4.0 star rating
"Overly rated coffee and tea shop. Suppose to be ""laptop free"" on the weekends, yet this is not enforced so there's no where to sit and enjoy your pretty looking 12oz  cup of coffee for $5.75. Must admit, the lady at the front counter was inviting, friendly and took the time to explain their menu and explained how the menu items with the stars are the favorites.",2.0 star rating
"This is def a cute but quality coffee shop. Every time I come here, the workers are extremely nice and awesome. Most times, it's pretty packed and may be hard to get a table, but there are ""no laptop"" tables which are nice. Menu is very large so there's options for everyone!! Their specialty lattes (birthday cake, red velvet, rose, lavender, etc) are priced higher than regular but think they're so much fun and actually really good. Drinks are well made and very enjoyable to drink!! Other than their classic menu, they have other specialty menu items like affogatos and teas!! Food wise, they have toasts that are really good as well and offer third culture pastries ( a plus!!!!) they're so good!!Overall, love this place and come in when I can. It just gets really busy at times of day and I like to sit and enjoy my coffee!!",5.0 star rating
"I've been here a couple of times and this place is so cute!! I always get the lavendar latte... seriously one of my favorite lattes ever! Love coming here on an early weekend morning, sipping coffee and people watch. I've had the avocodo toast here and it is delicious! This place is always  packed with people studying. Really don't know how people can study in such a loud space. But the tables are usually occupied with students. Your best bet is to sit by the window or take your coffee to go.",5.0 star rating
"I dragged my boyfriend here for the cute basic lattes. We came at noon on a holiday and it was packed. Like packed to where we were unable to get a table, and ended up consuming our drinks and food while standing. Not a big deal because we just used the little counter area by the door. For drinks, we ordered the Cookie Monster Latte and the Birthday Cake Latte. Although they were cute, they didn't taste any better than a typical latte from most other coffee shops. For noms, we ordered the Bravo and the Truffle Pesto Toasts. The bravo was your typical avocado toast with some bacon and radish. Compared to other avo toasts you can get in the city, this one failed to impress due to the lack of seasoning (not even pepper?) The truffle pesto toast served on a fluffy thick slice of bread with cherry tomatoes was much better, super yummy! Service was meh. The kitchen accidentally made us the kimchi toast instead of the Bravo Toast. Normally, we would just eat an incorrect order to avoid being annoying, but since neither of us likes kimchi, we asked to get our toast corrected. At first we were told we could keep the wrong toast since they were just going to throw it out, and then I was called over and told they actually want it back...interesting. They did give us the correct toast pretty speedily though. Overall, unless I'm trying to have something cute on my Instagram story I wouldn't come back.",3.0 star rating
Came here to do some work with a few friends.It's a bit noisy if you want to get work done without any headphones. The drinks are pretty good. The toasts are delicious. their latte art is on point. The place isn't too big and can get a bit crowded. Remember to ask for the WiFi password!,4.0 star rating
"I Love love loveHome!They have oatmilk! The servers are nice, the place is cute, the menu variety is great. I love that they encourage unplugging and talking. It's so crowded that every time I've gone I've sat with total strangers and always had a good time!Both locations are great!! I love birthday cake rainbow latte and condensed milk toast! Both are just soooooo good !!",5.0 star rating
"What a cute cafe with such beautiful and unique drinks! Seeing all the pictures on Yelp I had to go for the birthday cake latte (even though the cookie monster latte was a close second choice...next time!). The birthday cake latte doesn't actually taste like birthday cake and I believe has a vanilla and hazelnut base. It's not too sweet (granted I probably have a higher sweet tolerance) and is deliciously aromatic. Service can be a little slow since I'm sure the latte art takes awhile to create! You may also have to wait a bit for a table as the spot is pretty popular and can get crowded. Be prepared for lots of girls sitting nearby squealing over the drinks and getting pics for the 'gram =P. Kinda far away from where I live in North Beach so I don't think I'll be coming here on a regular basis, but definitely worth a visit if you're in the Sunset area!",4.0 star rating
"Came here to get some work done and overall, it was a pretty chill experience.Walking in around 10AM it was pretty busy already. Luckily I found a tight spot (in between 2 people) on the bar in front of the window. I ordered the Cookie Monster latte which was 'eh', nothing great. The cookies inside were a little stale, maybe from the heat of the coffee. And I ordered the toast with tomatoes, pesto, truffle, and mozzarella, adding a fried egg on top and it was pretty good! I got a few people asking me what I ordered because it looked so good. For the 2 items I paid around $16 which I found pretty overpriced but it's a SF cafe, what else could I expect?Knocking down 1 star because I wish they offered more outlets to charge your laptop, specifically at the bar. Also because I still found it to be a little overpriced as previously mentioned. But hey, this was all part of the SF cafe experience ultimately!",4.0 star rating
"I love home! Came here for the first time earlier this week on a Tuesday at 10am and there were plenty seats available to study/do work. The drink selections all sounded soooo good, but I opted for the Holy Cow which contains condensed milk. I'm not much of coffee/latte drinker because caffeine usually gives me a headache but the drink I had was perfect and didn't give me that after feeling I usually have with coffee.I also ordered a toast - the bacon, avocado and radish toast. I thought it was a bit expensive at $7, but it was healthy and filled me up, so it did the deed. Free WiFi here with outlets and plenty of seats. Friendly workers. 10/10 would recommend.",5.0 star rating
"Cute little place. Very clean, modern, light, hipster.It's very much a quintessential San Francisco Cafe, which means it's pretty good.My Tomato oil truffle pesto toast was good. Classic toast really. I'm not a huge fan of the super light and thick piece of toast, but it was still good. You know, $7 is ridiculous, but that's the going rate in the City, so it's not really a knock to them.My Lavender Latte was sweater than expected, but that's my bad for not asking I suppose. They coffee itself was good, but I was disappointed it didn't taste more like lavender. In the future I'd try their plain coffee instead of getting ""creative."" It did have some very nice latte art in though. Effort appreciated. It's a nice touch that they have some tables that are designated not for laptops!",4.0 star rating
What is better than home?-Coming to this small place in San Francisco Sunset area!When you're feeling decadent & you need your morning coffee?-Affogato (complete with cone)!We were there early. . .-Which is good because it started filling up when we were leaving!,4.0 star rating
"Visiting friends in SF, my husband was craving caffeine and sweets. My friend recommended Home for tasty latte creations on the sweeter side.I managed to steal just a few sips of husband's Nutella mocha. Yes, normally that would be Nutella latte, but he asked for Nutella mocha--he likes his coffee seriously sweet .Verdict:  Delicious! And surprisingly actually not too sweet.The interior at Home is lots of hard surfaces yet still a cozy atmosphere, I  spend a few hours here reading or whatever.",5.0 star rating
"This a great joint to try just for the cute coffee art.  They give double shots of espresso in the cup.  The latte are huge.  They customize your drinks and have good service to cater to your tastes.  They're known for their specialty drinks like the birthday latte.  Though many of them have too much syrup and they're too sweet that takes away the coffee flavor.  It would be nice to have natural flavors for specialty drinks.  I also like they have a variety of toasts, both sweet and savory.  The savory ones could be a good snack or a meal if you're not hungry.  I will have to come back and try one of their toasts. The seats aren't that comfortable, so it's not an ideal place to come and read/work for a long time.  They also have signs on some tables that forbid you to bring a computer.",4.0 star rating
"My favorite coffee shop in the city for the following reasons:1) AMAZING latte art 2) DELICIOUS and UNIQUE specialty lattes (condensed milk latte, birthday cake latte, Cookie Monster with little cookies in it, lavender latte, etc.)3) YUMMY toasts (LOVE the Bravocado)4) Free Wifi and environment conducive to getting work/studying done5) Beautiful simple decor, great for the 'gramAnd of course, easy street parking all around.I love this place, wish I lived closer. I still make a point of coming here once in a while whenever I'm in the neighborhood or need to get some work done!",4.0 star rating
"They have the best flavor latte! Ask for oat milk and you can thank me later, it makes the drink so much more creamier... yum I was in love at first sip! Parking can be a pain so plan accordingly if u gonna study/work in the cafe.",5.0 star rating
