Description,Rating
"I really wanted to like this place, but I guess I am not cut out for pretentious SFO neighborhood cafes! Soulshine was WAY more fun and yum! We stopped here for some quick breakfast. The girl getting my order was so distracted with the other girl she was talking to, it took her 2 transactions to get 2 drinks and 2 sandwiches right, ugh. She was also super cold and not friendly. There was one guy (who honestly looked like a high school kid) making our sandwiches. Took him 15 minutes to slap cream cheese on bagels and add avocado to one of them. Fifteen.Minutes. I am not kidding about this - also, ours were the only orders he was working on. As I watched him slowly wrap each sandwich in foil paper, I wanted to snatch it out of his hands, he was SO slow. Call me impatient, but it really got on my nerves.The bagels themselves were too chewy, the avocado was browning and stale. Would I come back to this place? Nope..Totally meh experience, and way too overpriced for what we got, to be honest.",2.0 star rating
"Super cute cafe in San Fran that I stumbled upon. The space is a little tight for seating or waiting on to go orders which is my only complaint. Otherwise the food looked delicious - avocado bagel sandwiches, and I ordered a latte which was delicious and the perfect temperature. A small was $4+ which is a little pricey given the size. Also OMG their homemade pop tarts are a must.",4.0 star rating
"This cafe was easy to find parking for, had nice and friendly baristas and free WiFi, which made getting work done easy and convenient. There was a decent group of others working remotely on their laptops but the noise level was not a distraction at all. The restroom was also clean and tidy.",4.0 star rating
"Really cute coffee shop. I love the patio seating and the hip interior. The service was also good. I ordered a soy cap (see in photo how it looks like a latte?) and it was very good! However, after getting through the first layer of foam, I was sad to see that there was only an inch of foam in my cappuccino, thus making it a latte. Regardless, it was really solid. My cousin ordered granola and it looked very good as well. I'm allergic to bananas so I didn't take a nibble but the portion was nice. Lots of people in this cafe working and reading so it's a bit tough to find a spot during their peak hours.",4.0 star rating
"Classic SF coffee shop. I came here to do some work on a Saturday. While the WiFi was slow, I still enjoyed the ambiance and decor. I got a glass of rosé, a salami sandwich and a raspberry pop tart spontaneously. The sandwich was quite good and although I would have liked some more filling the pop tart was light and flaky.",4.0 star rating
"Without a doubt one of the worst experiences I've had at a coffee shop. Went with my wife this past Sunday morning. We got in line behind a man and his daughter who appeared to know the woman working the counter as they had a long conversation in Hebrew as he ordered. After they ordered and walked away, the woman behind the counter stood there for a good three minutes waving and making faces at the child who was now sitting at a table just outside of the cafe. Meanwhile, a line had formed behind me that went all of the way out of the door and onto the sidewalk. Yet she continued to make faces at the child. Eventually, she took a cookie out from a jar and walked it to the child before coming back inside (by now there were approximately 15 people in line behind me). When she got to the counter, she looked at me and said ""what?""No ""hello"". No ""good morning"". No ""what would you like to order?"" Just ""What?"" as though I was annoying her by being there. I ordered a latte and a buttered bagel, my wife ordered a latte and asked the woman whether or not she could get a bagel with avocado. The woman responded ""It's on the menu, you can read it"" Yes, we had the menu with us and it was confusing as to whether or not it was an option so my wife sought clarification only to receive a condescending response.I cannot remember the last time someone was so rude to us at a coffee shop, restaurant or any service industry position. It was mind blowing. It felt like she had a grudge against us for something but we had never been here before and had never seen this woman before. Beyond unacceptable way to treat customers. If I could give zero stars, I would. Finally, after being second in line only to wait over 15 minutes we had finally placed our order only to wait another 15-20 minutes for them to make two simple bagels!  As if that wasn't bad enough, the coffee was average at best, and the bagels were stale.",1.0 star rating
"The Apple & Brie sandwich was simply made, but really tasty! A baguette with slices of apples and brie with arugula and honey! Great combo of flavors. Good for a light meal or heavy snack. Pretty comfortable little spot, with both inside seating and outside.Didn't try their coffee, so no comment on that.",5.0 star rating
"I love this place.  The coffee is great, they play good music and the people that work there are rad.  The wine & beer menu is great too - only a few options, but they seem well curated.  They place gets a ton of sun and has nice outdoor seating as well.  The only downside I'd say is that there are too many computers and not enough books, but that's how it goes these days I suppose.",5.0 star rating
"This is a really great place to work with an awesome music selection, coffee and good selection of food. Only issue is there are not many outlets to plug in your laptop.",5.0 star rating
"First-time visit & find the interior very cool.-Ordered yogurt w/ granola & fruits + honey drizzles. Tastes great. -Fast internet & great place for work-Very limited seating though, I could not find a set-Parking was also not easy to find. -Cute decor & plants-Food is a bit pricey but good quality.",4.0 star rating
"1. No outlets, wtf. . . ok this cafe is aesthetically pleasing, but a lot of people come to do work and if we can't charge our devices, how do you expect us to get work done? There were three outlets in the back and all had a sticker saying ""no power"". A lot of my peers and I are students and are tired of studying on campus so we look for nice, ambient places to relax and get a change of scenery, we thought this would be the place.2. The workers aren't welcoming. I asked if they had coconut milk and received a disgusted facial expression. It was a simple question. Additionally, I brought left overs from lunch and wasn't able to go home and had nowhere to put it and was told in a condescending manner that I could not bring outside food, even if I wasn't going to eat it. Their reasoning was that it would stink up the place, which I think is such a minor reason to make a big deal out of. It was at that moment I felt unwelcome. 3. There's a two hour wifi limit, lol, ok. I mean the wifi already sucked. I really wanted to enjoy this place, especially the fact that it was barely 5 minutes away from campus.4. Expensive, pretentious, arrogant, ""wannabe"" hipster employees,I won't be coming back.p.s. I came a couple days before to do work; however, there was no open seating, so I've tried coming here before. Both times sucked.",1.0 star rating
"Don't be fooled by their homemade poptarts.The price for one is costly and um...do you see the raspberry filling?Yeah, neither did I. I just tasted dry crust and they said to keep eating until I got to the middle. Um, here's a picture of the middle. Where's the filling?Average coffee but disappointing poptart, but since I want to support local businesses I'll give this 3 stars instead of two.",3.0 star rating
"Stopped by for a quick coffee on a Sunday morning. No real line at around 10:30 in the morning, which was a pleasant surprise. Ordered a flat white and waited 5-10 minutes for it to be made. Flat white was exactly as I like it.Overall, a great spot with quick service, cute decor and reasonable prices.",5.0 star rating
Cozy neighborhood cadre with free WiFi and wonderful expresso.  Easy street parking on MacAllister and lots of tables inside and out.Friendly staff.  Nice place to work in peace or enjoy coffee with friends.Highly recommended,5.0 star rating
I'm confused about this place! It's on a cute street corner in a cute and more quiet neighborhood. The inside gets great lighting and there's outdoor seating too.I got the Kenyan pourover but it just tasted too watered down. I would hesitate to get anything here again bc of how bad the coffee was. But the place is so cute I want to like it!,2.0 star rating
Awesome place! Grilled cheese with Apple is a must. We had it and our boys had it without the apple. So yummy. Everything is really good. Loved the Mediterranean bars and the apple sauce was spectacular. Please open another location in the city so we can have your food more often.,5.0 star rating
"The Randall museum gets packed full of small children and their parents running around learning things, so as a result Cafe Josephine also shares the same population. If you are looking for a nice quiet peaceful spot to grab a coffee and read a book, this may not be the ideal place for you. They have a cute little cafe space with a couple of baristas serving up high-quality coffee, tea, and bagels and sandwiches. There is a lovely outdoor patio space, however they don't provide enough tables, and as a result the four or five tables end up feeling a little bit cramped next to your neighbors. The overall vibe is like a watering hole for parents to restock on caffeine to continue running around with their children, while stopping in for a little snack break. The view is lovely though, and I would certainly return earlier in the morning for some peace and quiet.",4.0 star rating
"Well wouldn't this have been great when Law School Girl was little and we were at the Randall all of the time? Fast forward a bunch of years and yah there's a cafe at the Randall! And the food is really good and the views are still fantastic! There were a bunch of parents with little ones in tow enjoying a snack and the view. The kids all seemed to like theirgrilled cheese ...and so did I.  I also had an arugula salad with almonds, prosciutto, mint, shaved fennel,burrata and lemon dressing. I was just as good as it sounds.",4.0 star rating
"We've always loved the Randall Museum and missed it while it was being renovated, but one of the best things about the renovation is the addition of Café Josephine: a much needed and long awaited onsite café and food stop for families.  Holding it's grand opening this past June 2018, Café Josephine just upped the Randall Museum's game.  This ain't your lame and basic park and rec food concession with limpy hotdogs under heat lamps, and packaged, processed, sugared up baked goods.  Owners Sahara and Jason are thoughtful about their food offerings, and Café Josephine offers up fresh, locally sourced and organic produce and food made to order.  Food is super fresh and delicious:  salads are tasty (the kale salad and egg salad is our fav), fresh baked cookies, homemade and healthy ""lunchables"" that kids love, made to order grilled cheese options and creative toasts (tartines), organic hot soups, and sandwiches too.  (...And we love that they add fresh sliced strawberries to your lemonade - it's the little touches that make the biggest difference!)  They make killer Andytown Coffee espresso drinks (and even have your Snowy Plover if you're craving it) and have a great selection of premium teas as well.The café is the perfect place to stop and take a deep breath with a coffee in hand (steamed milk with cinnamon for the kiddies) and take in the sweeping 360 views before you set out to conquer the City or about take on the Randall's animal room.  You're literally in the heart of the city, and yet you feel like you're miles away from it all.  Now go and visit!  You won't be disappointed.",5.0 star rating
"I'm a fan. Food is fresh and delicious.  Variety is great. Andytown coffee is the real thing. I'm coming back, often.",5.0 star rating
Lovely spot for delish eats and great coffee! Try their special Snowy Plover coffee soda!,5.0 star rating
"LOVE Cafe Josephine. The staff is super welcoming and warm. The selection of food is amazing - whether I'm looking for a quick breakfast & coffee, a leisure lunch or just a snack! AND there are great options for my kiddos too! It's a great compliment to the Randall, as there is something for the whole family, or just for me to enjoy when I want to work outdoors and enjoy some good coffee and yummy food. Can't go wrong with any items off their regular menu or their seasonal fare. Highly recommend!",5.0 star rating
Great lunch options & I love Andytown coffee! Grilled cheese with ham and pesto is my go-to. Sahara has a great sensibility for having a delicious food offering for anyone and everyone.,5.0 star rating
"Cafe Josephine is an amazing addition to the Randall Museum. The coffee is great, the food is delicious, and they have great options for children and adults. For me, it means staying at the Randall longer because we don't need to stop for coffee or go home for lunch. But even if I didn't have kids or any interest in the museum, I would definitely come for a coffee or lunch and to enjoy the stunning view.  The staff are also super nice and accommodating.",5.0 star rating
"Went to the Randall museum today and stopped it to their cafe. It was clean and sweet. They had an array of goodies to offer. I had a baguette with salami and cheddar which was delicious and my son had a fruit cup and apple juice that he loved. We also had a chocolate chip cookie that was amazing as well. Everything was very fresh and staff was very friendly. I will definitely be going back, many other things to try especially the coffee. This place is a great asset to the children's museum.",5.0 star rating
Great cafe with an incredible view! Lots of outdoor seating to relax and take some sun (or watch Karl the fog!). I had their grilled ham and cheese sandwich and it was very tasty. Service is excellent. Definitely will come back!,5.0 star rating
Such a cute little spot. We came here on a Saturday afternoon and it was actually full. We were hoping to find a nice quiet place to sit down and get some reading done but we ended up just grabbing some coffee and walking around.We got a vanilla latte and it came out beautifully. It had so much flavor and them foam and crema was perfect. We even saw bits of real vanilla at the bottom of the cup. A little expensive but hey it's SF. We'll try to come back when it's less busy so we can enjoy the quaint vibe of this place.,5.0 star rating
"Normally I love cozy little coffee shops, but this place is just not up par to other coffee shops in SF. Here's why:- extremely limited options for milk. They only have whole milk and sweetened almond milk- unfriendly staff who are in their head- no wifi (which is common on the weekend for most popular places) - barely any seatingAlthough their Cold Brew was good, me thinks not for coming again :(.",3.0 star rating
"For a fancy coffee joint, it was just average for me.  If it's good espresso, then it should have a balanced taste.  However the espresso con panna tasted a bit sour. It may have been a bad batch of whipped cream.  However the cappuccino wasn't that impressive either. The milk didn't mask the subpar coffee flavor. I liked the decor and atmosphere. However the coffee is just average and the place didn't have that many places for me to work.  It maybe an ok spot for a few friends to chill and talk though.",3.0 star rating
I wish i could take my tip back. Douchebag dropped the mixing cup on the ground then rinsed it and got snippy with me when i politely asked if he could maybe use another glass. Don't go here.,1.0 star rating
"Sightglass is one of the top quality coffee brands in the city and is definitely a favorite of mine. I like this mission location a lot just because it is more of a to go place with some indoor seating and no wifi. People come as they please and the overall mood here is relaxing and peaceful. I got a chilled flashed coffee which was something that sounds very cool, but really means the hot drip coffee was poured into a cup with ice. I did like how sightglass encourages customers to bring their own cups/jars etc. The only thing that kinda grossed me out was that there was a horseshoe fly buzzing around in the pastry display and that turned me off from buying anything in there. But overall, good service at this location and would come again.",4.0 star rating
"What a cute cute cute cafe that makes super good good good coffee located in an industrial area (is it really called Dog Patch?). It is within walking distance from Tartine Manufactury (wink, wink).Ordered their Mocha and you could tell that dark chocolate was used.",5.0 star rating
"Great hipster coffee place and a popular location for all the Mission folks. There's almost always people hanging out inside and on the bench outside with Sightglass drinks. I have yet to try their regular coffees, but the vanilla cold brew was very smooth and refreshing, albeit a bit sweet for my tastes. The mocha is hands-down my favorite drink. The chocolate is bittersweet, so its not overwhelming sweet like the typical mocha's you would get. You can also easily substitute dairy with almond or soy milk as well. Each hot drink is made carefully and with some kind of heart-like latte art too :) Wait time might be a bit longer as they don't rush the process. Condiments and caps are located in a corner at the back of the store. Also they take NFC payments and tap cards.",5.0 star rating
"Last stop in SF before heading to the airport. I believe we got the Ethiopian over ice, since they didn't have plain cold brew/iced coffee. Great bean recommendation by the barista! Theres a few seats inside but I don't think it's a great place to get work done.",4.0 star rating
"tldr; best coffee shop for meeting up or studying!I went into this shop initially because the unique name of this coffee shop caught my eye. What I found was the perfect, aesthetic coffee shop (sadly no WiFi though :'( ) that had ample interior seating and great coffee. The coffee is fairy price (I got a latte for $4), and ambience is wonderful for being productive or quietly chatting with friends.If I lived closer to this coffee shop, I would totally come here to work all the time! (on anything that didn't require WiFi, that is).",5.0 star rating
"Pretty chill environment , this coffee shop has kind of a neighborhood flair . The staff are really helpful and very informative. If you are a hipster that likes to pop up at coffee shops with your mac book and pretend to look important , this is defanitly the place for you .  I typically like to see if coffee shops are dog friendly and this obe didn't really have that feel. The shop is located behind a huge tree in front of the building so its kinda hard to find.",4.0 star rating
"Writing reviews for my 3 favorite Sightglass coffee shops. Video sketch on all 3 locations. youtu.be/CKyLAk5jzuQThis location is in Mission/Dogpatch area. Compared to shops on Divisadero(medium) or 7th street(large), the space here is small size. A lot of people come and go in the morning, so sometimes you have to wait for a seat. Because it's not a large space, crowd is more quiet. The lighting, color, furniture, tile, etc.. give you a warm and special feeling and their design theme continues in other stores like the one on Divisadero. Again, I think their coffee and the thought they put in spatial design is on another level :) Stop here to get coffee and then you can head to Tartine Manufactory to grab pastry. (5min walk) Only negative thing is it's difficult to find parking.",5.0 star rating
"Everything about Sightglass is literal coffee goals. I've heard about it many times from coffee folks, and have seen their beans served everywhere here in San Diego. I've finally visited it for the first time and was totally amused by it. Their aesthetics are on point, the elegant wooden coffee shop vibe with the honeycomb floors. Their coffee is great, and like I said earlier they have their beans for wholesale everywhere in California. It's almost a staple that good coffee is served here if you see Sightglass coffee beans. Not the biggest shop (I believe the one on 7th street is bigger with two floors), but everything about it screams SF. The baristas, the decor, the customers, you name it. You can tell they are passionate about their craft, and I absolutely love that. I would definitely come back with friends to try other items on their menu.",5.0 star rating
Coffee: Great and I like the simple menu where everything is amazing!Prices: Reasonable for San Francisco.Service: Super friendly and fast.Atmosphere: Beautiful inside; wish they had more seating.Location: In an up-and-coming portion of the Mission near a lot of cute shops and restaurants!,4.0 star rating
Moving to SF had made it a point to explore new coffee spots every weekend and this is among one of my favorite spot. Really nice setting and the coffee flavor is on point. Don't forget to check out the pastry options :),5.0 star rating
"Great place to chill and have a cup of coffee and great tasting pasty, they roast their own coffee too and it is a great thing that you can sit and see the process.",5.0 star rating
It's a pastry life! Sightglass sources from my favorite neighborhood bakeries. And the coffee is delicious to boot. This is the ultimate neighborhood coffee joint.,5.0 star rating
Good coffee house in the Dog Patch neighborhood. Starbucks is good but lacks the uniqueness of places like this. Will return for its variety of coffees.,4.0 star rating
"A little pricey, but delicious cappuccino and pistachio croissant with blackberry jam. Everything was beautiful in this location. All of the pastries were aesthetically, clearly labeled. This was my first time at this location (or at any Sightglass). I enjoyed my experience. I grabbed my croissant and cappuccino to go. They made a beautiful heart - the latte art/""coffee"" sign in the floor tiles outside of the door are great for Instagram fodder. The cappuccino could've been a little bigger for the price, but I'll be back.",5.0 star rating
"Wonderful interior, wish there was more space. Wonderful neighborhood. You can park your cycle outside and sip some fine coffee at peace. No WiFi so plan accordingly. Bay Area prices, but there's  style, expert baristas and good conversations to look forward to. I like their stance: cappuccino with whole milk and almond milk only. No other milk options.",4.0 star rating
"no iced coffee, no wifi, seating for like 4.25 people. Atlas is 100% better. Barista had an attitude which I guess is a job requirement, but geesh at least look up when a customer walks in.",3.0 star rating
"Wonderful little coffee shop. It's normally staffed with just one really awesome and kind barista at a time, so be patient and expect good coffee. Oh and it's right next to Chinatown. What's I like:-Coffee?-Affordability. $3.50 for a cappuccino is good in my books.-Great staff! The whole rotation of baristas are awesome in their own way.-The shop itself is small and cute.-Accessible by cable car.-Very personal experience.What I dislike: -Nothing! Keep on dishing out great coffee.-",5.0 star rating
"I'm writing this 5mins after I left. I stumbled to this place as I was walking around Chinatown, reminiscing childhood memories. I've never thought a coffee shop like this would exist so close to a place I cherish a lot. The ambiance definitely caught my eye. The decor was spot on- very simple, elegant, and peaceful. This place is not your sit down coffee shop, it's more of a stop and go place. There are no chairs inside and it's a bit small. The menu consist of various unique coffee and tea. I went with the vanilla spice latte, and it was very delicious. The cable car runs through from time to time to really give you that full San Francisco experience.  I'm slightly bias with The Coffee Movement as not only did I enjoyed the good coffee, but the awesome childhood memories it brought back.",4.0 star rating
"Such a great find! It's a fairly random location, but well worth the walk from the financial district. They had a number of espresso options but I had Heart out of Portland. The guys who run the shop are super nice as well.",5.0 star rating
"I found this little gem one Sunday when I was in a crisis of wanting to go out, but not knowing where to go. I saw that they were closing in 40 minutes, so I rushed over from where I lived and managed to get in the door with about 20 minutes to spare.This is a small, but well-lit and clean shop. If I had to model my future kitchen area, I would use this shop as inspiration. It's minimal, no-nonsense, and really puts the focus on the coffee and how it's being made. I'd go as far as to say that the all-white interior was so that the coffee could provide the colour. I've been here twice, having ordered a cappuccino and a latte. Both times, I was in awe at how much grace and passion went into making my cup. The attention to detail in providing an experience was evident, as I also was passed a lid on a small saucer. Talk about making me feel special.Both coffees were ready to drink, at the right temperature right away. I couldn't taste any hints of the espresso being burnt, and it tasted oh-so-smooth. I knew I couldn't get my coffee from anywhere else now. I'm ready to spend a lot more money here in order to try everything on the menu.It turns out you can really taste the love someone puts into making your coffee.",5.0 star rating
